call_number,item_number,level,title,object_number,priref,date_string,date_start,date_end,quantity,url,parent_url,number_images,images,subjects,people
ON 160/Item 0351,0351,ITEM,"Item 0351: Tribune negatives including Homosexual demonstration, Liverpool Court, Sydney, New South Wales, July 1978",1045519,110369584,July 1978,1978-01-01 00:00:00,1978-12-31 00:00:00,23 negatives,http://archival.sl.nsw.gov.au/Details/archive/110369584,http://archival.sl.nsw.gov.au/Details/archive/110369583,0,,demonstrations|gays,
ON 160/Item 0352,0352,ITEM,"Item 0352: Tribune negatives including US bases rally, Sydney, New South Wales, July 1978",1045520,110369585,July 1978,1978-01-01 00:00:00,1978-12-31 00:00:00,24 negatives,http://archival.sl.nsw.gov.au/Details/archive/110369585,http://archival.sl.nsw.gov.au/Details/archive/110369583,0,,rallies|demonstrators (political),
ON 160/Item 0353,0353,ITEM,"Item 0353: Tribune negatives including seamen picket demonstration, Melbourne, Victoria, July-September 1978",1045521,110369586,July-September 1978,1978-01-01 00:00:00,1978-12-31 00:00:00,17 negatives,http://archival.sl.nsw.gov.au/Details/archive/110369586,http://archival.sl.nsw.gov.au/Details/archive/110369583,0,,merchant seamen|demonstrations,
ON 160/Item 0355,0355,ITEM,"Item 0355: Tribune negatives including Mururoa demonstration and CUBA Youth festival delegations, Sydney Airport, July 1978",1045523,110369587,July 1978,1978-01-01 00:00:00,1978-12-31 00:00:00,25 negatives,http://archival.sl.nsw.gov.au/Details/archive/110369587,http://archival.sl.nsw.gov.au/Details/archive/110369583,0,,demonstrations|delegations|youth,
ON 160/Item 0356,0356,ITEM,"Item 0356: Tribune negatives including Technical and Further Education and CYSS demonstrations, Sydney, New South Wales, July 1978",1045525,110369588,July 1978,1978-01-01 00:00:00,1978-12-31 00:00:00,41 negatives,http://archival.sl.nsw.gov.au/Details/archive/110369588,http://archival.sl.nsw.gov.au/Details/archive/110369583,0,,demonstrations|technical education,
ON 160/Item 0357,0357,ITEM,"Item 0357: Tribune negatives including Hiroshima Day march, Sydney, New South Wales, August 1978",1045526,110369589,August 1978,1978-01-01 00:00:00,1978-12-31 00:00:00,40 negatives,http://archival.sl.nsw.gov.au/Details/archive/110369589,http://archival.sl.nsw.gov.au/Details/archive/110369583,0,,uranium|demonstrations,
ON 160/Item 0358,0358,ITEM,"Item 0358: Tribune negatives including Hiroshima Day march, Sydney, New South Wales, August 1978",1045527,110369590,August 1978,1978-01-01 00:00:00,1978-12-31 00:00:00,25 negatives,http://archival.sl.nsw.gov.au/Details/archive/110369590,http://archival.sl.nsw.gov.au/Details/archive/110369583,0,,demonstrations|uranium,
ON 160/Item 0359,0359,ITEM,"Item 0359: Tribune negatives including Australian Teacher Education Association strike meetings, Wentworth Park, New South Wales, August 1978",1045528,110369591,August 1978,1978-01-01 00:00:00,1978-12-31 00:00:00,26 negatives,http://archival.sl.nsw.gov.au/Details/archive/110369591,http://archival.sl.nsw.gov.au/Details/archive/110369583,0,,strikes|meetings|teachers,
ON 160/Item 0360,0360,ITEM,"Item 0360: Tribune negatives including National Aborigines Day and Hiroshima Day marches, Melbourne, Victoria, August 1978",1045529,110369592,August 1978,1978-01-01 00:00:00,1978-12-31 00:00:00,35 negatives,http://archival.sl.nsw.gov.au/Details/archive/110369592,http://archival.sl.nsw.gov.au/Details/archive/110369583,0,,Aboriginal peoples (Australians)|land rights|demonstrations|uranium,
ON 160/Item 0361,0361,ITEM,"Item 0361: Tribune negatives including James Hardie demonstration at Asbestos House, August 1978",1045530,110369593,August 1978,1978-01-01 00:00:00,1978-12-31 00:00:00,37 negatives,http://archival.sl.nsw.gov.au/Details/archive/110369593,http://archival.sl.nsw.gov.au/Details/archive/110369583,0,,demonstrations|asbestos fabric,
ON 160/Item 0363,0363,ITEM,"Item 0363: Tribune negatives including Yuraygir National Park demonstration and child care centre, August 1978",1045531,110369594,August 1978,1978-01-01 00:00:00,1978-12-31 00:00:00,29 negatives,http://archival.sl.nsw.gov.au/Details/archive/110369594,http://archival.sl.nsw.gov.au/Details/archive/110369583,0,,demonstrations|national parks|child-care centres,
ON 160/Item 0364,0364,ITEM,"Item 0364: Tribune negatives including Sydney Budget rally, New South Wales, August 1978",1045532,110369595,August 1978,1978-01-01 00:00:00,1978-12-31 00:00:00,41 negatives,http://archival.sl.nsw.gov.au/Details/archive/110369595,http://archival.sl.nsw.gov.au/Details/archive/110369583,0,,budgets (government)|political rallies,
ON 160/Item 0365,0365,ITEM,"Item 0365: Tribune negatives including Medibank demonstration, Sydney, New South Wales, August 1978",1045537,110369597,August 1978,1978-01-01 00:00:00,1978-12-31 00:00:00,44 negatives,http://archival.sl.nsw.gov.au/Details/archive/110369597,http://archival.sl.nsw.gov.au/Details/archive/110369583,0,,demonstrations|health services,
ON 160/Item 0366,0366,ITEM,"Item 0366: Tribune negatives including Australian Teacher Education Association back to work meeting, September 1978",1045539,110369599,September 1978,1978-01-01 00:00:00,1978-12-31 00:00:00,42 negatives,http://archival.sl.nsw.gov.au/Details/archive/110369599,http://archival.sl.nsw.gov.au/Details/archive/110369583,0,,meetings|teachers,
ON 160/Item 0367,0367,ITEM,"Item 0367: Tribune negatives including gay liberation and homosexual demonstrations, Sydney, New South Wales, September 1978",1045540,110369600,September 1978,1978-01-01 00:00:00,1978-12-31 00:00:00,34 negatives,http://archival.sl.nsw.gov.au/Details/archive/110369600,http://archival.sl.nsw.gov.au/Details/archive/110369583,0,,gays|demonstrations|gay rights,
ON 160/Item 0368,0368,ITEM,"Item 0368: Tribune negatives including Chile demonstration and abortion rally, Sydney, New South Wales, September 1978",1045541,110369601,September 1978,1978-01-01 00:00:00,1978-12-31 00:00:00,22 negatives,http://archival.sl.nsw.gov.au/Details/archive/110369601,http://archival.sl.nsw.gov.au/Details/archive/110369583,0,,rallies|demonstrations|abortion,
ON 160/Item 0369,0369,ITEM,"Item 0369: Tribune negatives including Judy Mundey and Tribune staff, September 1978",1045542,110369602,September 1978,1978-01-01 00:00:00,1978-12-31 00:00:00,34 negatives,http://archival.sl.nsw.gov.au/Details/archive/110369602,http://archival.sl.nsw.gov.au/Details/archive/110369583,0,,workers|women,"Mundey, Judith Ann, 1944-"
ON 160/Item 0370,0370,ITEM,"Item 0370: Tribune negatives including Eden Park child care and Water Board workers stop work meeting, Sydney, New South Wales, September 1978",1045543,110369603,September 1978,1978-01-01 00:00:00,1978-12-31 00:00:00,34 negatives,http://archival.sl.nsw.gov.au/Details/archive/110369603,http://archival.sl.nsw.gov.au/Details/archive/110369583,0,,child-care centres|workers|meetings,
ON 160/Item 0371,0371,ITEM,"Item 0371: Tribune negatives including concerned citizens meeting, Sydney Town Hall and Uranium rally, Martin Plaza, New South Wales, September 1978",1045544,110369604,September 1978,1978-01-01 00:00:00,1978-12-31 00:00:00,34 negatives,http://archival.sl.nsw.gov.au/Details/archive/110369604,http://archival.sl.nsw.gov.au/Details/archive/110369583,0,,meetings|rallies|uranium,
ON 160/Item 0372,0372,ITEM,"Item 0372: Tribune negatives including budget rallies, Melbourne, Victoria and Parramatta, New South Wales, September 1978",1045545,110369605,September 1978,1978-01-01 00:00:00,1978-12-31 00:00:00,37 negatives,http://archival.sl.nsw.gov.au/Details/archive/110369605,http://archival.sl.nsw.gov.au/Details/archive/110369583,0,,rallies|budgets (government),
ON 160/Item 0373,0373,ITEM,"Item 0373: Tribune negatives including gay demonstration, Sydney, September 1978",1045546,110369606,September 1978,1978-01-01 00:00:00,1978-12-31 00:00:00,42 negatives,http://archival.sl.nsw.gov.au/Details/archive/110369606,http://archival.sl.nsw.gov.au/Details/archive/110369583,0,,demonstrations|gays,
ON 160/Item 0374,0374,ITEM,"Item 0374: Tribune negatives including budget rally, Sydney, New South Wales, September 1978",1045547,110369607,September 1978,1978-01-01 00:00:00,1978-12-31 00:00:00,5 negatives,http://archival.sl.nsw.gov.au/Details/archive/110369607,http://archival.sl.nsw.gov.au/Details/archive/110369583,0,,budgets (government)|rallies,
ON 160/Item 0375,0375,ITEM,"Item 0375: Tribune negatives including APM meetings, Botany Bay, New South Wales, October 1978",1045548,110369608,October 1978,1978-01-01 00:00:00,1978-12-31 00:00:00,40 negatives,http://archival.sl.nsw.gov.au/Details/archive/110369608,http://archival.sl.nsw.gov.au/Details/archive/110369583,0,,meetings|workers,
ON 160/Item 0376,0376,ITEM,"Item 0376: Tribune negatives including East Timor demonstration, South Australia, October 1978",1045550,110369609,October 1978,1978-01-01 00:00:00,1978-12-31 00:00:00,38 negatives,http://archival.sl.nsw.gov.au/Details/archive/110369609,http://archival.sl.nsw.gov.au/Details/archive/110369583,0,,demonstrations|demonstrators (political),
ON 160/Item 0377,0377,ITEM,"Item 0377: Tribune negatives including rail maintenance workers meeting and government printers picket, Sydney, New South Wales, October 1978",1045555,110369610,October 1978,1978-01-01 00:00:00,1978-12-31 00:00:00,33 negatives,http://archival.sl.nsw.gov.au/Details/archive/110369610,http://archival.sl.nsw.gov.au/Details/archive/110369583,0,,pickets|meetings|printers (people)|railway workers,
ON 160/Item 0378,0378,ITEM,"Item 0378: Tribune negatives including Mary Whitehouse demonstration and rally, Sydney, New South Wales, October 1978",1045561,110369611,October 1978,1978-01-01 00:00:00,1978-12-31 00:00:00,39 negatives,http://archival.sl.nsw.gov.au/Details/archive/110369611,http://archival.sl.nsw.gov.au/Details/archive/110369583,0,,abortion|demonstrations|rallies,
ON 160/Item 0379,0379,ITEM,"Item 0379: Tribune negatives including maternity leave demonstration, Melbourne, Victoria and rail workers meeting, Redfern, New South Wales, October 1978",1045562,110369612,October 1978,1978-01-01 00:00:00,1978-12-31 00:00:00,23 negatives,http://archival.sl.nsw.gov.au/Details/archive/110369612,http://archival.sl.nsw.gov.au/Details/archive/110369583,0,,meetings|railway workers|demonstrations|women,
ON 160/Item 0380,0380,ITEM,"Item 0380: Tribune negatives including Phil Gissing, Vicki Wooten and PLO demonstration, Sydney, October 1978",1045563,110369613,October 1978,1978-01-01 00:00:00,1978-12-31 00:00:00,40 negatives,http://archival.sl.nsw.gov.au/Details/archive/110369613,http://archival.sl.nsw.gov.au/Details/archive/110369583,0,,demonstrations|portraits,
ON 160/Item 0381,0381,ITEM,"Item 0381: Tribune negatives including Medibank demonstration, Melbourne, Victoria, November 1978",1045564,110369614,November 1978,1978-01-01 00:00:00,1978-12-31 00:00:00,35 negatives,http://archival.sl.nsw.gov.au/Details/archive/110369614,http://archival.sl.nsw.gov.au/Details/archive/110369583,0,,demonstrations|demonstrators (political),
ON 160/Item 0382,0382,ITEM,"Item 0382: Tribune negatives including disarmament rally, Sydney, New South Wales, November 1978",1045565,110369615,November 1978,1978-01-01 00:00:00,1978-12-31 00:00:00,33 negatives,http://archival.sl.nsw.gov.au/Details/archive/110369615,http://archival.sl.nsw.gov.au/Details/archive/110369583,0,,rallies|disarmament,
ON 160/Item 0383,0383,ITEM,"Item 0383: Tribune negatives including Wollongong City Council workers dispute, November 1978",1045566,110369616,November 1978,1978-01-01 00:00:00,1978-12-31 00:00:00,36 negatives,http://archival.sl.nsw.gov.au/Details/archive/110369616,http://archival.sl.nsw.gov.au/Details/archive/110369583,0,,labour disputes|council workers,
ON 160/Item 0384,0384,ITEM,"Item 0384: Tribune negatives including citizens for democracy dinner and arbitration court demonstration, Melbourne, Victoria, November 1978",1045575,110369623,November 1978,1978-01-01 00:00:00,1978-12-31 00:00:00,42 negatives,http://archival.sl.nsw.gov.au/Details/archive/110369623,http://archival.sl.nsw.gov.au/Details/archive/110369583,0,,dinners|demonstrations,
ON 160/Item 0385,0385,ITEM,"Item 0385: Tribune negatives including Malcolm Fraser and gay solidarity march, Sydney, New South Wales, November 1978",1045584,110369632,November 1978,1978-01-01 00:00:00,1978-12-31 00:00:00,42 negatives,http://archival.sl.nsw.gov.au/Details/archive/110369632,http://archival.sl.nsw.gov.au/Details/archive/110369583,0,,demonstrations|men,"Fraser, Malcolm, 1930-"
ON 160/Item 0386,0386,ITEM,"Item 0386: Tribune negatives including Lou Gibson, D. Williams and Harry Carslate, November 1978",1045586,110369634,November 1978,1978-01-01 00:00:00,1978-12-31 00:00:00,16 negatives,http://archival.sl.nsw.gov.au/Details/archive/110369634,http://archival.sl.nsw.gov.au/Details/archive/110369583,0,,portraits|demonstrations,
ON 160/Item 0387,0387,ITEM,"Item 0387: Tribune negatives including Clyde Cameron College (TUTA), December 1978",1045587,110369635,December 1978,1978-01-01 00:00:00,1978-12-31 00:00:00,41 negatives,http://archival.sl.nsw.gov.au/Details/archive/110369635,http://archival.sl.nsw.gov.au/Details/archive/110369583,0,,schools & colleges,
ON 160/Item 0388,0388,ITEM,"Item 0388: Tribune negatives including women in unions, Philippines reactor demonstrations and APM meeting, December 1978",1045588,110369636,December 1978,1978-01-01 00:00:00,1978-12-31 00:00:00,34 negatives,http://archival.sl.nsw.gov.au/Details/archive/110369636,http://archival.sl.nsw.gov.au/Details/archive/110369583,0,,demonstrations|meetings|women,
ON 160/Item 0389,0389,ITEM,"Item 0389: Tribune negatives including ABC picket and Tribune fair, Sydney, New South Wales, December 1978",1045592,110369639,December 1978,1978-01-01 00:00:00,1978-12-31 00:00:00,33 negatives,http://archival.sl.nsw.gov.au/Details/archive/110369639,http://archival.sl.nsw.gov.au/Details/archive/110369583,0,,pickets|fetes,
ON 160/Item 0390,0390,ITEM,"Item 0390: Tribune negatives including budget rally, Canberra, Australian Capital Territory, December 1978",1045593,110369640,December 1978,1978-01-01 00:00:00,1978-12-31 00:00:00,33 negatives,http://archival.sl.nsw.gov.au/Details/archive/110369640,http://archival.sl.nsw.gov.au/Details/archive/110369583,0,,rallies|budgets (government),
ON 160/Item 0391,0391,ITEM,"Item 0391: Tribune negatives including budget rally, Canberra, Australian Capital Territory, December 1978",1045594,110369641,December 1978,1978-01-01 00:00:00,1978-12-31 00:00:00,38 negatives,http://archival.sl.nsw.gov.au/Details/archive/110369641,http://archival.sl.nsw.gov.au/Details/archive/110369583,0,,budgets (government)|rallies,
ON 160/Item 0392,0392,ITEM,"Item 0392: Tribune negatives including budget rally, Canberra, December 1978",1045595,110369642,December 1978,1978-01-01 00:00:00,1978-12-31 00:00:00,29 negatives,http://archival.sl.nsw.gov.au/Details/archive/110369642,http://archival.sl.nsw.gov.au/Details/archive/110369583,0,,rallies|budgets (government),
ON 160/Item 0393,0393,ITEM,"Item 0393: Tribune negatives including budget rally, Canberra, Australian Capital Territory, December 1978",1045596,110369643,December 1978,1978-01-01 00:00:00,1978-12-31 00:00:00,21 negatives,http://archival.sl.nsw.gov.au/Details/archive/110369643,http://archival.sl.nsw.gov.au/Details/archive/110369583,0,,rallies|budgets (government),
ON 160/Item 0394,0394,ITEM,"Item 0394: Tribune negatives including Parents, teachers and MAUM demonstrations, Melbourne, Victoria, December 1978",1045597,110369644,December 1978,1978-01-01 00:00:00,1978-12-31 00:00:00,38 negatives,http://archival.sl.nsw.gov.au/Details/archive/110369644,http://archival.sl.nsw.gov.au/Details/archive/110369583,0,,demonstrations|migrants|teachers|parents,
ON 160/Item 0395,0395,ITEM,"Item 0395: Tribune negatives including Communist Party of Australia program, meeting, Newcastle, New South Wales, December 1978",1045599,110369646,December 1978,1978-01-01 00:00:00,1978-12-31 00:00:00,31 negatives,http://archival.sl.nsw.gov.au/Details/archive/110369646,http://archival.sl.nsw.gov.au/Details/archive/110369583,0,,meetings|political parties,
ON 160/Item 0396,0396,ITEM,"Item 0396: Tribune negatives including Queensland solidarity demonstration and Medibank rally, Sydney, New South Wales, December 1978",1045600,110369647,December 1978,1978-01-01 00:00:00,1978-12-31 00:00:00,34 negatives,http://archival.sl.nsw.gov.au/Details/archive/110369647,http://archival.sl.nsw.gov.au/Details/archive/110369583,0,,demonstrations|rallies,
ON 160/Item 0397,0397,ITEM,"Item 0397: Tribune negatives including ABC rally, Hyde Park and health workers demonstration, Sydney, New South Wales, December 1978",1045601,110369648,December 1978,1978-01-01 00:00:00,1978-12-31 00:00:00,31 negatives,http://archival.sl.nsw.gov.au/Details/archive/110369648,http://archival.sl.nsw.gov.au/Details/archive/110369583,0,,rallies|demonstrations|health workers,
ON 160/Item 0398,0398,ITEM,"Item 0398: Tribune negatives including Communist Party of Australia Woman's Conference, Melbourne, Victoria, February 1979",1045603,110369650,February 1979,1979-01-01 00:00:00,1979-12-31 00:00:00,36 negatives,http://archival.sl.nsw.gov.au/Details/archive/110369650,http://archival.sl.nsw.gov.au/Details/archive/110369583,0,,conventions|women,
ON 160/Item 0399,0399,ITEM,"Item 0399: Tribune negatives including Aboriginal co-operative opening and South Africa demonstration against Wild Geese, Sydney, New South Wales, February 1979",1045604,110369651,February 1979,1979-01-01 00:00:00,1979-12-31 00:00:00,32 negatives,http://archival.sl.nsw.gov.au/Details/archive/110369651,http://archival.sl.nsw.gov.au/Details/archive/110369583,0,,demonstrations|cooperatives|Aboriginal peoples (Australians),
ON 160/Item 0400,0400,ITEM,"Item 0400: Tribune negatives including Neville Wran and Dick Roughsey at Tranby Aboriginal Co-op opening, February 1979",1045606,110369653,February 1979,1979-01-01 00:00:00,1979-12-31 00:00:00,34 negatives,http://archival.sl.nsw.gov.au/Details/archive/110369653,http://archival.sl.nsw.gov.au/Details/archive/110369583,0,,cooperatives|Aboriginal peoples (Australians)|men,
